{
  "$schema": "http://json-schema.org/draft-07/schema#",
  "$id": "https://niovlabs.com/foundation/dandelion-recommendation/recommendation.schema.json",
  "title": "NIOV Foundation Dandelion Stage C Recommendation Substrate Schema",
  "description": "Validation schema for D3 Dandelion Recommendation Substrate at docs/dandelion-recommendation/. Each file is a wrapper containing kind + catalog_version + envelope_defaults + items[]. Each item is a MapRecommendation that consumes the matching D2 MapAssessment output_candidates and proposes ranked Map regions for D4 Governance Review. STATIC RECOMMENDATION SUBSTRATE ONLY — every recommendation_state is PROPOSED_NOT_APPROVED. Per ADR-0082 + Amendment 1: Dandelion maps the territory; admins approve the map; Foundation governs what can happen inside the map.",
  "type": "object",
  "required": ["kind", "catalog_version", "envelope_defaults", "items"],
  "additionalProperties": false,
  "properties": {
    "$schema": { "type": "string" },
    "envelope_defaults": { "$ref": "#/definitions/EnvelopeDefaults" },
    "kind": { "type": "string", "enum": ["MapRecommendation"] },
    "catalog_version": { "type": "string", "pattern": "^[0-9]+\\.[0-9]+\\.[0-9]+$" },
    "items": { "type": "array", "minItems": 1, "items": { "$ref": "#/definitions/RecommendationItem" } }
  },
  "definitions": {
    "RecommendationItem": {
      "type": "object",
      "required": [
        "id",
        "version",
        "status",
        "object_type",
        "map_type",
        "name",
        "description",
        "human_readable_summary",
        "model_usage_notes",
        "source_adr_refs",
        "consumes_assessment_id",
        "ranked_regions",
        "rationale",
        "cross_map_dependencies",
        "approval_gate_required",
        "confidence_label",
        "DMW_scope_implications",
        "governance_review_points",
        "safe_defaults",
        "forbidden_defaults",
        "allowed_consumers",
        "forbidden_consumers",
        "audit_expectations",
        "recommendation_state"
      ],
      "properties": {
        "id": { "type": "string", "pattern": "^[a-z][a-zA-Z0-9_-]*(\\.[a-zA-Z0-9][a-zA-Z0-9_-]*)+\\.v[0-9]+$" },
        "version": { "type": "string", "pattern": "^[0-9]+$" },
        "status": { "type": "string", "enum": ["ACCEPTED", "PROPOSED", "DEPRECATED"] },
        "object_type": { "type": "string", "const": "MapRecommendation" },
        "map_type": {
          "type": "string",
          "enum": [
            "CompanyMap",
            "OrgRelationshipMap",
            "RoleMap",
            "ToolMap",
            "WorkflowMap",
            "AuthorityMap",
            "MemoryDmwMap",
            "RiskMap",
            "AhaMomentMap"
          ]
        },
        "name": { "type": "string", "minLength": 1 },
        "description": { "type": "string", "minLength": 1 },
        "human_readable_summary": { "type": "string", "minLength": 1 },
        "model_usage_notes": { "type": "string", "minLength": 1 },
        "source_adr_refs": {
          "type": "array",
          "minItems": 1,
          "items": { "type": "string", "pattern": "^(ADR-[0-9]{4}|RULE [0-9]+|US [0-9,]+)$" }
        },
        "consumes_assessment_id": { "type": "string", "pattern": "^assessment\\.[a-z][a-zA-Z0-9_-]*(\\.[a-zA-Z0-9][a-zA-Z0-9_-]*)*\\.v[0-9]+$" },
        "ranked_regions": {
          "type": "array",
          "minItems": 1,
          "items": {
            "type": "object",
            "required": ["region_id", "region_label", "rank", "confidence_label", "rationale_summary"],
            "properties": {
              "region_id": { "type": "string", "minLength": 1 },
              "region_label": { "type": "string", "minLength": 1 },
              "rank": { "type": "integer", "minimum": 1 },
              "confidence_label": {
                "type": "string",
                "enum": [
                  "HIGH_CONFIDENCE",
                  "MEDIUM_CONFIDENCE",
                  "LOW_CONFIDENCE",
                  "REQUIRES_ADMIN_REVIEW",
                  "REQUIRES_USER_CONFIRMATION",
                  "BLOCKED_BY_POLICY"
                ]
              },
              "rationale_summary": { "type": "string", "minLength": 1 }
            },
            "additionalProperties": true
          }
        },
        "rationale": { "type": "string", "minLength": 1 },
        "cross_map_dependencies": {
          "type": "array",
          "items": { "type": "string" }
        },
        "approval_gate_required": { "type": "string", "minLength": 1 },
        "confidence_label": {
          "type": "string",
          "enum": [
            "HIGH_CONFIDENCE",
            "MEDIUM_CONFIDENCE",
            "LOW_CONFIDENCE",
            "REQUIRES_ADMIN_REVIEW",
            "REQUIRES_USER_CONFIRMATION",
            "BLOCKED_BY_POLICY"
          ]
        },
        "DMW_scope_implications": { "type": "array", "items": { "type": "string" }, "minItems": 1 },
        "governance_review_points": { "type": "array", "items": { "type": "string" }, "minItems": 1 },
        "safe_defaults": { "type": "array", "items": { "type": "string" } },
        "forbidden_defaults": { "type": "array", "items": { "type": "string" } },
        "allowed_consumers": { "type": "array", "items": { "type": "string" } },
        "forbidden_consumers": { "type": "array", "items": { "type": "string" } },
        "audit_expectations": { "type": "array", "items": { "type": "string" }, "minItems": 1 },
        "recommendation_state": { "type": "string", "const": "PROPOSED_NOT_APPROVED" }
      },
      "additionalProperties": true
    },
    "EnvelopeDefaults": {
      "type": "object",
      "required": [
        "object_type",
        "human_readable_summary",
        "model_usage_notes",
        "scope_defaults",
        "permission_defaults",
        "provenance",
        "audit_expectations",
        "policy_purpose",
        "allowed_consumers",
        "forbidden_consumers",
        "sensitivity_level"
      ],
      "additionalProperties": true,
      "properties": {
        "object_type": { "type": "string" },
        "human_readable_summary": { "type": "string" },
        "model_usage_notes": { "type": "string" },
        "scope_defaults": { "type": "array", "items": { "type": "string" } },
        "permission_defaults": { "type": "array", "items": { "type": "string" } },
        "provenance": {
          "type": "object",
          "required": ["authored_by", "source", "version_tag", "captured_at", "authority"],
          "properties": {
            "authored_by": { "type": "string" },
            "source": { "type": "string" },
            "version_tag": { "type": "string" },
            "captured_at": { "type": "string" },
            "authority": { "type": "string" }
          }
        },
        "audit_expectations": { "type": "array", "items": { "type": "string" } },
        "policy_purpose": { "type": "string" },
        "allowed_consumers": { "type": "array", "items": { "type": "string" } },
        "forbidden_consumers": { "type": "array", "items": { "type": "string" } },
        "sensitivity_level": { "type": "string", "enum": ["LOW", "MEDIUM", "HIGH", "CRITICAL"] }
      }
    }
  }
}
